{
  "schema_version": "suite-artifact-manifest.v1",
  "run_id": "cc90e3cf-040f-4366-9f08-5e9c1df63ca0",
  "suite": "ready-for-handoff-suite",
  "model": "mock:test-model",
  "run_environment": {
    "forgedan_version": "1.2.0",
    "python_version": "3.14.5",
    "python_implementation": "CPython",
    "platform": "Windows-11-10.0.26100-SP0",
    "os": "Windows"
  },
  "generated_at": "2026-06-03T06:47:41.056790Z",
  "report_acceptance": {
    "status": "passed",
    "criteria_count": 3,
    "ready_for_handoff": true
  },
  "artifact_count": 20,
  "artifacts": [
    {
      "path": "suite-result.json",
      "media_type": "application/json",
      "size_bytes": 16167,
      "sha256": "fb46d02eb1a7a6351c0da7ccb0d49cf780e36cc5fcb931e6b64d3a4c2f3430f8",
      "sensitivity": "restricted",
      "audience": "authorized_reviewers"
    },
    {
      "path": "suite-cases.jsonl",
      "media_type": "application/x-ndjson",
      "size_bytes": 1498,
      "sha256": "9d7b3f24ba250d1e2f94e48f2c3bc420c8769c655de83343f9f6c454bc9c3391",
      "sensitivity": "restricted",
      "audience": "authorized_reviewers"
    },
    {
      "path": "suite-evidence.csv",
      "media_type": "text/csv",
      "size_bytes": 232,
      "sha256": "4a83ed85fab8e7bfad546190e313377de52b028b9e3f867bc994fcafe63a9f96",
      "sensitivity": "restricted",
      "audience": "authorized_reviewers"
    },
    {
      "path": "suite-case-matrix.csv",
      "media_type": "text/csv",
      "size_bytes": 939,
      "sha256": "a9127ff0db59328f16d8f8680262f8e39c1fb6c8e9ef9ddd70b1f46eb947ec74",
      "sensitivity": "public",
      "audience": "external_reviewers"
    },
    {
      "path": "suite-risk-register.json",
      "media_type": "application/json",
      "size_bytes": 259,
      "sha256": "d5b13b1828175f4cd9428ad6feae75073aaec20cc840336317689db0fefbb93f",
      "sensitivity": "internal",
      "audience": "assessment_team"
    },
    {
      "path": "suite-risk-register.csv",
      "media_type": "text/csv",
      "size_bytes": 223,
      "sha256": "e96f0d29db9abc84e31aed106c958dc50f23420deff90d52e1f2415fdd67a6dc",
      "sensitivity": "internal",
      "audience": "assessment_team"
    },
    {
      "path": "suite-coverage.json",
      "media_type": "application/json",
      "size_bytes": 1027,
      "sha256": "91da7b9f3bf59fe36a1cfffad961a54d6847c84af41701498ca6ce4d72a79cd9",
      "sensitivity": "public",
      "audience": "external_reviewers"
    },
    {
      "path": "suite-coverage.csv",
      "media_type": "text/csv",
      "size_bytes": 230,
      "sha256": "f3d07a2f6bfb3139601409fc00d9a8fd06e7890d3ca4698e6dcc22ff1d299e61",
      "sensitivity": "public",
      "audience": "external_reviewers"
    },
    {
      "path": "suite-config.json",
      "media_type": "application/json",
      "size_bytes": 3121,
      "sha256": "88d841f916cee298e23860c3f8b6e2726c8805d628d78b71159af68f474f742c",
      "sensitivity": "internal",
      "audience": "assessment_team"
    },
    {
      "path": "suite-preflight.json",
      "media_type": "application/json",
      "size_bytes": 3736,
      "sha256": "89023e17bbbe7a32fad456a2eb0a49ade206c38a4692716460838d1c1dfcfd38",
      "sensitivity": "internal",
      "audience": "assessment_team"
    },
    {
      "path": "suite-preflight.md",
      "media_type": "text/markdown",
      "size_bytes": 1894,
      "sha256": "acc921b6e2c053361665e3e5a3bca4ecca6af0b5096acdc08fdc94791426d73a",
      "sensitivity": "internal",
      "audience": "assessment_team"
    },
    {
      "path": "suite-report.html",
      "media_type": "text/html",
      "size_bytes": 11408,
      "sha256": "3f34516292e6dfbd737d45e97a7ebba4943bb21edac547b9a940ebf07cb6465b",
      "sensitivity": "restricted",
      "audience": "authorized_reviewers"
    },
    {
      "path": "suite-report.md",
      "media_type": "text/markdown",
      "size_bytes": 8858,
      "sha256": "df0564e92a7ba0ee4e8818e4fc57348a3fe67de3caf947ed012b2bd89423efae",
      "sensitivity": "restricted",
      "audience": "authorized_reviewers"
    },
    {
      "path": "suite-release-notes.md",
      "media_type": "text/markdown",
      "size_bytes": 2099,
      "sha256": "ff752332735aacb89d084606e9298f39b3b2c8ba025254b2c38f3a6b55170e66",
      "sensitivity": "restricted",
      "audience": "authorized_reviewers"
    },
    {
      "path": "suite-result-redacted.json",
      "media_type": "application/json",
      "size_bytes": 16549,
      "sha256": "04ebe53a6d3a3c553272a0aa6416a80cfd84ffe108aecf37a7ebc78ab1c0a532",
      "sensitivity": "public",
      "audience": "external_reviewers"
    },
    {
      "path": "suite-cases-redacted.jsonl",
      "media_type": "application/x-ndjson",
      "size_bytes": 1516,
      "sha256": "90fa882e46b09c4fc56b659379ea8af6aa06fc40406628c52f550a961ad378d9",
      "sensitivity": "public",
      "audience": "external_reviewers"
    },
    {
      "path": "suite-report-redacted.html",
      "media_type": "text/html",
      "size_bytes": 11572,
      "sha256": "d8d5db1a3b9e1b0a49488ce985c05b55cd7dafdc98beb8c2b13ff17dc793d74d",
      "sensitivity": "public",
      "audience": "external_reviewers"
    },
    {
      "path": "suite-report-redacted.md",
      "media_type": "text/markdown",
      "size_bytes": 9022,
      "sha256": "9c76257732d4b5be2e43890804fc2f9a32bf3d513c000bca7bbf28209969872b",
      "sensitivity": "public",
      "audience": "external_reviewers"
    },
    {
      "path": "suite-public-bundle.md",
      "media_type": "text/markdown",
      "size_bytes": 2595,
      "sha256": "0ee858d4565efcf4db9bdba0ec84aaa7c7ca35f5da534a98df9333c428ba515d",
      "sensitivity": "public",
      "audience": "external_reviewers"
    },
    {
      "path": "suite-report-bundle.md",
      "media_type": "text/markdown",
      "size_bytes": 7232,
      "sha256": "dc6df5d3c914f574865e220de298c2269b85e40806bb3381cc42ca9ffa8d684c",
      "sensitivity": "restricted",
      "audience": "authorized_reviewers"
    }
  ],
  "schema_count": 10,
  "schemas": [
    {
      "name": "suite-result",
      "path": "schemas/suite-result.schema.json",
      "schema_id": "https://coff0xc.local/forgedan/schemas/suite-result.schema.json",
      "target_artifact": "suite-result.json"
    },
    {
      "name": "suite-config",
      "path": "schemas/suite-config.schema.json",
      "schema_id": "https://coff0xc.local/forgedan/schemas/suite-config.schema.json",
      "target_artifact": "suite-config.json"
    },
    {
      "name": "suite-manifest",
      "path": "schemas/suite-manifest.schema.json",
      "schema_id": "https://coff0xc.local/forgedan/schemas/suite-manifest.schema.json",
      "target_artifact": "suite-manifest.json"
    },
    {
      "name": "suite-comparison",
      "path": "schemas/suite-comparison.schema.json",
      "schema_id": "https://coff0xc.local/forgedan/schemas/suite-comparison.schema.json",
      "target_artifact": "suite-comparison.json"
    },
    {
      "name": "suite-comparison-manifest",
      "path": "schemas/suite-comparison-manifest.schema.json",
      "schema_id": "https://coff0xc.local/forgedan/schemas/suite-comparison-manifest.schema.json",
      "target_artifact": "suite-comparison-manifest.json"
    },
    {
      "name": "suite-qa-receipt",
      "path": "schemas/suite-qa-receipt.schema.json",
      "schema_id": "https://coff0xc.local/forgedan/schemas/suite-qa-receipt.schema.json",
      "target_artifact": "suite-qa-receipt.json"
    },
    {
      "name": "suite-preflight",
      "path": "schemas/suite-preflight.schema.json",
      "schema_id": "https://coff0xc.local/forgedan/schemas/suite-preflight.schema.json",
      "target_artifact": "suite-preflight.json"
    },
    {
      "name": "suite-risk-register",
      "path": "schemas/suite-risk-register.schema.json",
      "schema_id": "https://coff0xc.local/forgedan/schemas/suite-risk-register.schema.json",
      "target_artifact": "suite-risk-register.json"
    },
    {
      "name": "suite-coverage",
      "path": "schemas/suite-coverage.schema.json",
      "schema_id": "https://coff0xc.local/forgedan/schemas/suite-coverage.schema.json",
      "target_artifact": "suite-coverage.json"
    },
    {
      "name": "finding-taxonomy",
      "path": "schemas/finding-taxonomy.schema.json",
      "schema_id": "https://coff0xc.local/forgedan/schemas/finding-taxonomy.schema.json",
      "target_artifact": "finding-taxonomy.json"
    }
  ]
}